Key;Item Type;Publication Year;Author;Title;Publication Title;ISBN;ISSN;DOI;Date
W9MHEQMU;journalArticle;2012;"Nesta, Francesco; Omologo, Maurizio";Generalized State Coherence Transform for Multidimensional TDOA Estimation of Multiple Sources;IEEE Transactions on Audio, Speech, and Language Processing;;1558-7924;10.1109/TASL.2011.2160168;2012-01
RBRIVSP8;journalArticle;2010;"Nakadai, Kazuhiro; Takahashi, Toru; Okuno, Hiroshi G.; Nakajima, Hirofumi; Hasegawa, Yuji; Tsujino, Hiroshi";Design and Implementation of Robot Audition System 'HARK' — Open Source Software for Listening to Three Simultaneous Speakers;Advanced Robotics;;0169-1864;10.1163/016918610X493561;2010-01-01
Q9Q7GMBN;bookSection;2010;"Rafaely, Boaz; Peled, Yotam; Agmon, Morag; Khaykin, Dima; Fisher, Etan";Spherical Microphone Array Beamforming;Speech Processing in Modern Communication: Challenges and Perspectives;978-3-642-11130-3;;;2010
GHA76MD3;journalArticle;2013;"Marti, Amparo; Cobos, Maximo; Lopez, Jose J.; Escolano, Jose";A steered response power iterative method for high-accuracy acoustic source localization;The Journal of the Acoustical Society of America;;0001-4966;10.1121/1.4820885;2013-10-01
EV9DFG5G;journalArticle;1988;Fornberg, Bengt;Generation of finite difference formulas on arbitrarily spaced grids;Mathematics of Computation;;0025-5718, 1088-6842;10.1090/S0025-5718-1988-0935077-0;1988
ZPX9CREC;conferencePaper;2001;Albrecht, H.H.;A family of cosine-sum windows for high-resolution measurements;2001 IEEE International Conference on Acoustics, Speech, and Signal Processing. Proceedings (Cat. No.01CH37221);;;10.1109/ICASSP.2001.940309;2001-05
94D743XF;thesis;2020;Wagner, Jakub;Regularised differentiation of measurement data in systems for healthcare-oriented monitoring of elderly persons;;;;;2020-06-26
